{"$id":"https://knowledge-os.local/schemas/m25-model-policy-v1.schema.json","$schema":"https://json-schema.org/draft/2020-12/schema","additionalProperties":false,"properties":{"live_provider_calls_permitted":{"const":false},"max_attempts_per_provider":{"maximum":3,"minimum":1,"type":"integer"},"model_policy_sha256":{"pattern":"^[a-f0-9]{64}$","type":"string"},"routes":{"items":{"additionalProperties":false,"properties":{"mode":{"const":"recorded_replay"},"model_id":{"minLength":1,"type":"string"},"model_revision":{"minLength":1,"type":"string"},"provider_id":{"minLength":1,"type":"string"}},"required":["provider_id","model_id","model_revision","mode"],"type":"object"},"maxItems":3,"minItems":1,"type":"array"},"schema_version":{"const":"knowledge-engine-m25-model-policy/v1"}},"required":["schema_version","live_provider_calls_permitted","max_attempts_per_provider","routes","model_policy_sha256"],"title":"m25-model-policy-v1","type":"object"}
